{"granularity":"quarter","resolution":"daily","generated_at":1791968700,"series":{"clearnet":[[1785196800,5768,6352,22722],[1785283200,6520,7344,27007],[1785369600,7275,7861,23845],[1785456000,7494,8104,21344],[1785542400,7883,8477,19302],[1785628800,8067,8627,18494],[1785715200,8148,8739,18176],[1785801600,8213,8850,17991],[1785888000,8301,8884,16801],[1785974400,8440,9269,16941],[1786060800,8696,9389,18142],[1786147200,8831,9570,17036],[1786233600,8771,9633,16208],[1786320000,8836,9691,15799],[1786406400,8874,9710,15182],[1786492800,8898,9804,15896],[1786579200,9089,9967,16567],[1786665600,9181,10182,16100],[1786752000,9226,10139,14870],[1786838400,9240,10085,14792],[1786924800,9228,10005,13744],[1787011200,9147,9966,14086],[1787097600,9144,9908,13139],[1787184000,9063,9836,13293],[1787270400,9005,9738,12390],[1787356800,8955,9687,12504],[1787443200,8966,9626,12537],[1787529600,8930,9612,12185],[1787616000,8898,9576,12009],[1787702400,8876,9560,12490],[1787788800,8857,9536,11791],[1787875200,8822,9498,11933],[1787961600,8818,9506,11893],[1788048000,8821,9469,11883],[1788134400,8807,9448,11983],[1788220800,8784,9438,12060],[1788307200,8748,9420,11933],[1788393600,8719,9420,12134],[1788480000,8720,9378,11886],[1788566400,8646,9307,11384],[1788652800,8649,9281,11599],[1788739200,8658,9271,11388],[1788825600,8666,9274,12138],[1788912000,8604,9335,11737],[1788998400,8595,9285,11980],[1789084800,8583,9226,12190],[1789171200,8610,9238,12807],[1789257600,8628,9242,13458],[1789344000,8652,9276,13694],[1789430400,8641,9329,13094],[1789516800,8660,9316,13552],[1789603200,8617,9306,12843],[1789689600,8629,9268,12467],[1789776000,8655,9273,12811],[1789862400,8697,9287,12354],[1789948800,8695,9313,12438],[1790035200,8722,9319,12202],[1790121600,8707,9328,12361],[1790208000,8691,9311,12463],[1790294400,8687,9289,12128],[1790380800,8625,9259,11664],[1790467200,8606,9204,11466],[1790553600,8607,9199,11200],[1790640000,8593,9182,11344],[1790726400,8607,9192,11520],[1790812800,8602,9184,10984],[1790899200,8548,9151,10920],[1790985600,8520,9115,10793],[1791072000,8499,9084,10881],[1791158400,8500,9069,10940],[1791244800,8484,9066,10678],[1791331200,8492,9033,10818],[1791417600,8475,9023,10436],[1791504000,8451,9012,10285],[1791590400,8404,8954,10674],[1791676800,8417,8953,10306],[1791763200,8406,8923,10337],[1791849600,8380,8942,10824]],"onion":[[1785196800,235,235,18386],[1785283200,186,235,18387],[1785369600,188,188,19576],[1785456000,366,456,21454],[1785542400,270,458,21478],[1785628800,56,56,22266],[1785715200,691,691,22860],[1785801600,7935,7935,23416],[1785888000,10225,10225,24031],[1785974400,11015,11015,24497],[1786060800,11407,11407,24930],[1786147200,11173,11173,25496],[1786320000,10535,10535,26297],[1786406400,9934,9934,26602],[1786492800,10519,10519,26937],[1786579200,10634,10634,27401],[1786665600,10547,10547,27966],[1786752000,11329,11329,28413],[1786838400,11869,11869,28874],[1786924800,12045,12045,29181],[1787011200,10593,10593,29450],[1787097600,11633,11633,29691],[1787184000,12424,12424,29959],[1787270400,12274,12274,30103],[1787356800,12624,12624,30243],[1787443200,12076,12076,30346],[1787529600,12305,12305,30448],[1787616000,12612,12612,30578],[1787702400,12745,12745,30685],[1787788800,12586,12586,30757],[1787875200,12058,12058,30829],[1787961600,10453,10453,30893],[1788048000,12148,12148,30948],[1788134400,12008,12008,30996],[1788220800,12092,12092,31044],[1788307200,11991,11991,23905],[1788393600,12152,12152,31156],[1788480000,10574,10574,23258],[1788566400,11817,11817,22876],[1788652800,11438,11438,30534],[1788739200,11813,11813,22232],[1788825600,11467,11467,22571],[1788912000,11141,11141,23211],[1788998400,11377,11377,21551],[1789084800,11522,11522,21095],[1789171200,11150,11150,28569],[1789257600,11366,11366,20876],[1789344000,11128,11128,21200],[1789430400,11532,11532,21275],[1789516800,11635,11635,20028],[1789603200,8044,8044,19250],[1789689600,11229,11229,19758],[1789776000,11418,11418,19509],[1789862400,11544,11544,18760],[1789948800,11256,11256,18835],[1790035200,11357,11357,18441],[1790121600,11285,11285,25440],[1790208000,11422,11422,18199],[1790294400,11019,11019,19032],[1790380800,11313,11313,18813],[1790467200,11215,11215,17642],[1790553600,10951,10951,17475],[1790640000,11079,11079,17854],[1790726400,11894,11894,17662],[1790812800,11195,11195,17428],[1790899200,10915,10915,17459],[1790985600,11292,11292,17243],[1791072000,10929,10929,24275],[1791158400,11216,11216,17135],[1791244800,11217,11217,18114],[1791331200,10681,10681,17905],[1791417600,11292,11292,16783],[1791504000,11168,11168,16648],[1791590400,11041,11041,17085],[1791676800,10537,10537,16875],[1791763200,10524,10524,16726],[1791849600,6707,6707,16765]]}}
