{"granularity":"day","resolution":"snapshot","generated_at":1793005526,"series":{"clearnet":[[1792800048,7887,8254,8215],[1792800956,7819,8256,14232],[1792801886,7886,8256,8225],[1792802744,7892,8254,8186],[1792803641,7895,8253,8229],[1792804547,7878,8255,27913],[1792805440,7889,8255,8267],[1792806336,7892,8257,8248],[1792807253,7872,8256,8199],[1792808144,7854,8258,8213],[1792809054,7912,8259,8565],[1792809953,7693,8258,8223],[1792810852,7689,8257,8209],[1792811761,7707,8258,8301],[1792812680,7741,8258,8189],[1792813575,7764,8258,8223],[1792814477,7729,8258,8233],[1792815360,7794,8258,8194],[1792816254,7701,8259,8187],[1792817148,7885,8261,8204],[1792818049,7890,8263,8174],[1792818953,7857,8263,8183],[1792819867,7883,8262,8187],[1792820748,7915,8334,11216],[1792821659,7896,8335,11210],[1792822550,7935,8336,13646],[1792823448,7930,8335,11216],[1792824362,7940,8335,13407],[1792825247,7933,8334,13890],[1792826145,7916,8334,11222],[1792827045,7961,8335,11201],[1792827946,7907,8333,15368],[1792828843,7847,8333,17206],[1792829743,7872,8333,11210],[1792830635,7896,8333,13421],[1792831548,7913,8335,24216],[1792832445,7910,8334,11220],[1792833354,7906,8334,11235],[1792834258,7903,8333,11241],[1792835156,7906,8333,11215],[1792836048,7941,8334,11227],[1792836959,7895,8332,11208],[1792837858,7924,8334,11234],[1792838747,7942,8329,11244],[1792839657,7906,8327,11222],[1792840543,7889,8321,11203],[1792841445,7910,8322,11222],[1792842348,7945,8322,11208],[1792843245,7898,8321,11214],[1792844155,7937,8323,11225],[1792845038,7932,8322,11225],[1792845955,7927,8323,11213],[1792846848,7947,8323,11225],[1792847745,7966,8322,8245],[1792848648,7923,8320,11209],[1792849543,7953,8318,8243],[1792850449,7964,8317,8255],[1792851348,7940,8313,11237],[1792852238,7940,8315,8235],[1792853156,7938,8312,8264],[1792854051,7960,8312,8235],[1792854938,7944,8312,8267],[1792855845,7952,8311,11201],[1792856740,7907,8309,13647],[1792857664,7897,8307,8244],[1792858550,7950,8303,8257],[1792859459,7922,8301,14167],[1792860350,8000,8300,8229],[1792861243,7921,8298,8239],[1792862144,7915,8298,8254],[1792863045,7930,8301,8246],[1792863945,7831,8299,11206],[1792864842,7945,8299,8241],[1792865748,7969,8302,8244],[1792866658,7919,8300,8254],[1792867557,7937,8297,8254],[1792868454,7904,8298,8250],[1792869346,7955,8297,8248],[1792870247,7951,8297,8238],[1792871141,7941,8297,8253],[1792872042,7949,8296,8252],[1792872960,7913,8296,8249],[1792873848,7921,8295,8245],[1792874744,7944,8296,8264],[1792875626,7921,8296,8246],[1792876544,7923,8295,8254],[1792877450,7978,8292,8253],[1792878348,7905,8288,8242],[1792879236,7892,8288,11219],[1792880142,7903,8281,8234],[1792881061,7921,8284,10661],[1792881956,7924,8285,8241],[1792882845,7904,8285,10956],[1792883746,7915,8282,8242],[1792884646,7892,8286,18163],[1792885543,7928,8285,8237],[1792886443,7897,8286,14087],[1792887341,7893,8286,8244],[1792888249,7945,8286,8242],[1792889159,7879,8286,8237],[1792890046,7926,8284,8248],[1792890956,7884,8285,8230],[1792891848,7940,8285,25482],[1792892743,7914,8284,8251],[1792893644,7905,8285,8237],[1792894543,7894,8282,8236],[1792895445,7928,8282,8233],[1792896363,7646,8282,8272],[1792897254,7751,8282,8213],[1792898169,7773,8284,8248],[1792899068,7758,8283,8215],[1792899957,7792,8282,8226],[1792900862,7834,8281,8249],[1792901755,7767,8284,8243],[1792902651,7727,8284,8222],[1792903554,7816,8285,8274],[1792904443,7935,8281,8223],[1792905347,7952,8279,8223],[1792906255,7935,8281,8241],[1792907145,7995,8347,11062],[1792908052,7964,8348,10991],[1792908943,8014,8350,16586],[1792909857,7860,8349,11003],[1792910756,7941,8349,11017],[1792911656,7936,8349,11039],[1792912545,7955,8352,13243],[1792913452,8005,8351,11024],[1792914341,7934,8351,11014],[1792915244,7934,8351,22676],[1792916141,7976,8352,10996],[1792917044,7959,8351,25166],[1792917927,7923,8352,11024],[1792918848,8015,8350,10993],[1792919745,7950,8352,11059],[1792920646,7913,8352,11057],[1792921535,7922,8352,11054],[1792922446,7947,8353,11075],[1792923345,7920,8353,10987],[1792924248,7957,8355,11051],[1792925135,7922,8354,11074],[1792926050,7983,8354,11002],[1792926954,7885,8352,11052],[1792927858,7896,8353,11101],[1792928747,7927,8352,11005],[1792929643,7954,8352,11049],[1792930543,7925,8353,11104],[1792931447,7952,8352,10985],[1792932349,7978,8352,11046],[1792933245,7938,8353,10992],[1792934154,7955,8352,8319],[1792935099,7993,8351,11022],[1792935946,7773,8351,8263],[1792936847,7978,8349,8303],[1792937759,7884,8348,11013],[1792938657,7929,8348,8287],[1792939544,7934,8347,8299],[1792940463,7163,8346,8270],[1792941345,7967,8344,8265],[1792942225,7856,8344,16970],[1792943145,7989,8345,8270],[1792944043,7871,8346,8281],[1792944948,7962,8344,8277],[1792945823,7929,8345,13882],[1792946764,7951,8344,8293],[1792947644,7875,8339,8298],[1792948542,7953,8336,8324],[1792949453,7935,8335,8272],[1792950342,7953,8335,11025],[1792951245,7903,8333,8303],[1792952150,7940,8329,8270],[1792953045,7959,8329,8276],[1792953958,7905,8327,8311],[1792954847,7961,8324,8314],[1792955758,7829,8326,8291],[1792956651,7947,8325,8269],[1792957559,7950,8323,8272],[1792958448,7965,8323,8299],[1792959326,7965,8323,8287],[1792960257,7924,8322,8306],[1792961147,7941,8319,8277],[1792962061,7961,8317,8296],[1792962945,7906,8318,8276],[1792963850,7915,8318,8285],[1792964744,7905,8316,8277],[1792965654,7924,8316,10988],[1792966546,7951,8316,8307],[1792967445,7914,8315,11226],[1792968355,7897,8315,8265],[1792969244,7917,8316,10900],[1792970147,7909,8318,8287],[1792971034,7909,8317,8280],[1792971957,7919,8316,20391]],"onion":[[1792809293,11288,11288,16677],[1792895584,10761,10761,16670]]}}
